{
  "version": "oaep/0.1",
  "type": "TOOL_CALLED",
  "execution_id": "0x0123456789abcdef0123456789abcdef0123456789abcdef0123456789abcdef",
  "event_id": "0x5555555555555555555555555555555555555555555555555555555555555555",
  "seq": 4,
  "occurred_at": 1789084830,
  "commitment": "0x6666666666666666666666666666666666666666666666666666666666666666",
  "payload": {
    "tool_identity": "0x1111111111111111111111111111111111111111111111111111111111111111"
  }
}
